{
  "version": "1.0",
  "itemName": "Image",
  "itemType": "iic",
  "paramIdScore0001": {
    "content": "",
    "ref": "",
    "scene": "scene1"
  },
  "paramId0001": {
    "content": "image001",
    "ref": "",
    "scene": "scene1"
  },
  "paramId0002": {
    "content": "Cutebunny",
    "ref": "",
    "scene": "scene1"
  },
  "paramId0003": {
    "content": "one-day-things-will-get-better-until-then-here-is-a-drawing-of-a-cat.jpg",
    "ref": "",
    "scene": "scene1"
  },
  "paramId0004": {
    "content": "Bunny",
    "ref": "",
    "scene": "scene1"
  },
  "paramId0005": {
    "content": "400",
    "ref": "",
    "scene": "scene1"
  },
  "paramId0006": {
    "content": "400",
    "ref": "",
    "scene": "scene1"
  }
}
